[
  {
    "forecast_id": "fomc_2020-06-10_US_pce_2020",
    "forecaster_id": "fomc",
    "forecast_type": "indicator",
    "score_version": "0.1.0",
    "indicator": "pce",
    "predicted_value": 2.0,
    "direction_correct": null,
    "magnitude_error_bps": null,
    "timing_correct": null,
    "on_pace": null,
    "delivered_so_far": null,
    "predicted_total": null,
    "status": "pending",
    "resolved_at": null,
    "actual_value": null,
    "value_error": null,
    "value_signed_error": null
  },
  {
    "forecast_id": "fomc_2020-06-10_US_pce_2021",
    "forecaster_id": "fomc",
    "forecast_type": "indicator",
    "score_version": "0.1.0",
    "indicator": "pce",
    "predicted_value": 0.8,
    "direction_correct": null,
    "magnitude_error_bps": null,
    "timing_correct": null,
    "on_pace": null,
    "delivered_so_far": null,
    "predicted_total": null,
    "status": "pending",
    "resolved_at": null,
    "actual_value": null,
    "value_error": null,
    "value_signed_error": null
  },
  {
    "forecast_id": "fomc_2020-06-10_US_pce_2022",
    "forecaster_id": "fomc",
    "forecast_type": "indicator",
    "score_version": "0.1.0",
    "indicator": "pce",
    "predicted_value": 1.6,
    "direction_correct": null,
    "magnitude_error_bps": null,
    "timing_correct": null,
    "on_pace": null,
    "delivered_so_far": null,
    "predicted_total": null,
    "status": "pending",
    "resolved_at": null,
    "actual_value": null,
    "value_error": null,
    "value_signed_error": null
  },
  {
    "forecast_id": "fomc_2020-06-10_US_unemployment_2020",
    "forecaster_id": "fomc",
    "forecast_type": "indicator",
    "score_version": "0.1.0",
    "indicator": "unemployment",
    "predicted_value": 4.1,
    "direction_correct": null,
    "magnitude_error_bps": null,
    "timing_correct": null,
    "on_pace": null,
    "delivered_so_far": null,
    "predicted_total": null,
    "status": "pending",
    "resolved_at": null,
    "actual_value": null,
    "value_error": null,
    "value_signed_error": null
  },
  {
    "forecast_id": "fomc_2020-06-10_US_unemployment_2021",
    "forecaster_id": "fomc",
    "forecast_type": "indicator",
    "score_version": "0.1.0",
    "indicator": "unemployment",
    "predicted_value": 9.3,
    "direction_correct": null,
    "magnitude_error_bps": null,
    "timing_correct": null,
    "on_pace": null,
    "delivered_so_far": null,
    "predicted_total": null,
    "status": "pending",
    "resolved_at": null,
    "actual_value": null,
    "value_error": null,
    "value_signed_error": null
  },
  {
    "forecast_id": "fomc_2020-06-10_US_unemployment_2022",
    "forecaster_id": "fomc",
    "forecast_type": "indicator",
    "score_version": "0.1.0",
    "indicator": "unemployment",
    "predicted_value": 6.5,
    "direction_correct": null,
    "magnitude_error_bps": null,
    "timing_correct": null,
    "on_pace": null,
    "delivered_so_far": null,
    "predicted_total": null,
    "status": "pending",
    "resolved_at": null,
    "actual_value": null,
    "value_error": null,
    "value_signed_error": null
  },
  {
    "forecast_id": "fomc_2020-09-16_US_pce_2020",
    "forecaster_id": "fomc",
    "forecast_type": "indicator",
    "score_version": "0.1.0",
    "indicator": "pce",
    "predicted_value": 2.0,
    "direction_correct": null,
    "magnitude_error_bps": null,
    "timing_correct": null,
    "on_pace": null,
    "delivered_so_far": null,
    "predicted_total": null,
    "status": "pending",
    "resolved_at": null,
    "actual_value": null,
    "value_error": null,
    "value_signed_error": null
  },
  {
    "forecast_id": "fomc_2020-09-16_US_pce_2021",
    "forecaster_id": "fomc",
    "forecast_type": "indicator",
    "score_version": "0.1.0",
    "indicator": "pce",
    "predicted_value": 1.2,
    "direction_correct": null,
    "magnitude_error_bps": null,
    "timing_correct": null,
    "on_pace": null,
    "delivered_so_far": null,
    "predicted_total": null,
    "status": "pending",
    "resolved_at": null,
    "actual_value": null,
    "value_error": null,
    "value_signed_error": null
  },
  {
    "forecast_id": "fomc_2020-09-16_US_pce_2022",
    "forecaster_id": "fomc",
    "forecast_type": "indicator",
    "score_version": "0.1.0",
    "indicator": "pce",
    "predicted_value": 1.7,
    "direction_correct": null,
    "magnitude_error_bps": null,
    "timing_correct": null,
    "on_pace": null,
    "delivered_so_far": null,
    "predicted_total": null,
    "status": "pending",
    "resolved_at": null,
    "actual_value": null,
    "value_error": null,
    "value_signed_error": null
  },
  {
    "forecast_id": "fomc_2020-09-16_US_pce_2023",
    "forecaster_id": "fomc",
    "forecast_type": "indicator",
    "score_version": "0.1.0",
    "indicator": "pce",
    "predicted_value": 1.8,
    "direction_correct": null,
    "magnitude_error_bps": null,
    "timing_correct": null,
    "on_pace": null,
    "delivered_so_far": null,
    "predicted_total": null,
    "status": "pending",
    "resolved_at": null,
    "actual_value": null,
    "value_error": null,
    "value_signed_error": null
  },
  {
    "forecast_id": "fomc_2020-09-16_US_unemployment_2020",
    "forecaster_id": "fomc",
    "forecast_type": "indicator",
    "score_version": "0.1.0",
    "indicator": "unemployment",
    "predicted_value": 4.1,
    "direction_correct": null,
    "magnitude_error_bps": null,
    "timing_correct": null,
    "on_pace": null,
    "delivered_so_far": null,
    "predicted_total": null,
    "status": "pending",
    "resolved_at": null,
    "actual_value": null,
    "value_error": null,
    "value_signed_error": null
  },
  {
    "forecast_id": "fomc_2020-09-16_US_unemployment_2021",
    "forecaster_id": "fomc",
    "forecast_type": "indicator",
    "score_version": "0.1.0",
    "indicator": "unemployment",
    "predicted_value": 7.6,
    "direction_correct": null,
    "magnitude_error_bps": null,
    "timing_correct": null,
    "on_pace": null,
    "delivered_so_far": null,
    "predicted_total": null,
    "status": "pending",
    "resolved_at": null,
    "actual_value": null,
    "value_error": null,
    "value_signed_error": null
  },
  {
    "forecast_id": "fomc_2020-09-16_US_unemployment_2022",
    "forecaster_id": "fomc",
    "forecast_type": "indicator",
    "score_version": "0.1.0",
    "indicator": "unemployment",
    "predicted_value": 5.5,
    "direction_correct": null,
    "magnitude_error_bps": null,
    "timing_correct": null,
    "on_pace": null,
    "delivered_so_far": null,
    "predicted_total": null,
    "status": "pending",
    "resolved_at": null,
    "actual_value": null,
    "value_error": null,
    "value_signed_error": null
  },
  {
    "forecast_id": "fomc_2020-09-16_US_unemployment_2023",
    "forecaster_id": "fomc",
    "forecast_type": "indicator",
    "score_version": "0.1.0",
    "indicator": "unemployment",
    "predicted_value": 4.6,
    "direction_correct": null,
    "magnitude_error_bps": null,
    "timing_correct": null,
    "on_pace": null,
    "delivered_so_far": null,
    "predicted_total": null,
    "status": "pending",
    "resolved_at": null,
    "actual_value": null,
    "value_error": null,
    "value_signed_error": null
  },
  {
    "forecast_id": "fomc_2020-12-16_US_pce_2020",
    "forecaster_id": "fomc",
    "forecast_type": "indicator",
    "score_version": "0.1.0",
    "indicator": "pce",
    "predicted_value": 2.0,
    "direction_correct": null,
    "magnitude_error_bps": null,
    "timing_correct": null,
    "on_pace": null,
    "delivered_so_far": null,
    "predicted_total": null,
    "status": "pending",
    "resolved_at": null,
    "actual_value": null,
    "value_error": null,
    "value_signed_error": null
  },
  {
    "forecast_id": "fomc_2020-12-16_US_pce_2021",
    "forecaster_id": "fomc",
    "forecast_type": "indicator",
    "score_version": "0.1.0",
    "indicator": "pce",
    "predicted_value": 1.2,
    "direction_correct": null,
    "magnitude_error_bps": null,
    "timing_correct": null,
    "on_pace": null,
    "delivered_so_far": null,
    "predicted_total": null,
    "status": "pending",
    "resolved_at": null,
    "actual_value": null,
    "value_error": null,
    "value_signed_error": null
  },
  {
    "forecast_id": "fomc_2020-12-16_US_pce_2022",
    "forecaster_id": "fomc",
    "forecast_type": "indicator",
    "score_version": "0.1.0",
    "indicator": "pce",
    "predicted_value": 1.8,
    "direction_correct": null,
    "magnitude_error_bps": null,
    "timing_correct": null,
    "on_pace": null,
    "delivered_so_far": null,
    "predicted_total": null,
    "status": "pending",
    "resolved_at": null,
    "actual_value": null,
    "value_error": null,
    "value_signed_error": null
  },
  {
    "forecast_id": "fomc_2020-12-16_US_pce_2023",
    "forecaster_id": "fomc",
    "forecast_type": "indicator",
    "score_version": "0.1.0",
    "indicator": "pce",
    "predicted_value": 1.9,
    "direction_correct": null,
    "magnitude_error_bps": null,
    "timing_correct": null,
    "on_pace": null,
    "delivered_so_far": null,
    "predicted_total": null,
    "status": "pending",
    "resolved_at": null,
    "actual_value": null,
    "value_error": null,
    "value_signed_error": null
  },
  {
    "forecast_id": "fomc_2020-12-16_US_unemployment_2020",
    "forecaster_id": "fomc",
    "forecast_type": "indicator",
    "score_version": "0.1.0",
    "indicator": "unemployment",
    "predicted_value": 4.1,
    "direction_correct": null,
    "magnitude_error_bps": null,
    "timing_correct": null,
    "on_pace": null,
    "delivered_so_far": null,
    "predicted_total": null,
    "status": "pending",
    "resolved_at": null,
    "actual_value": null,
    "value_error": null,
    "value_signed_error": null
  },
  {
    "forecast_id": "fomc_2020-12-16_US_unemployment_2021",
    "forecaster_id": "fomc",
    "forecast_type": "indicator",
    "score_version": "0.1.0",
    "indicator": "unemployment",